{
  "generatedAt": "2026-03-16T19:24:12.362Z",
  "sourceFiles": [
    "content/source/music-library.authoritative.json",
    "js/routes.js"
  ],
  "counts": {
    "albums": 18,
    "tracks": 233
  },
  "albums": [
    {
      "id": "wings-of-fire",
      "title": "Wings of Fire",
      "artist": "Triad of Angels",
      "genre": "Female Group, Cinematic Pop, Orchestral, Ballad",
      "year": "May, 2025",
      "cover": "assets/images/albums/wingsoffire-album.webp",
      "artistInfo": "A clear entry point into Triad of Angels: cinematic pop, strong melodies, and the first shape of the trio’s emotional world.",
      "canonicalPath": "/music/albums/wings-of-fire/",
      "approxTimestamp": 1735689600000,
      "links": {
        "spotify": "https://open.spotify.com/album/4K83YJEeETmcybKtQ1LP5l?si=fOFELopLS9W3eLOSR8x5tA",
        "appleMusic": "https://music.apple.com/us/album/wings-of-fire-ep/1812163266",
        "youTubeMusic": "https://music.youtube.com/playlist?list=OLAK5uy_kpbLV2nL-Ryt_nKkJ8CFfll701Zrw9N6k&si=c0d1GLRChrOKtkbK"
      },
      "trackCount": 6,
      "tracks": [
        {
          "id": "awakening-the-triad",
          "title": "Awakening the Triad",
          "canonicalPath": "/music/tracks/wings-of-fire/awakening-the-triad/",
          "duration": "",
          "lyricsFile": "",
          "hasLyricsFile": false,
          "hasVideo": false,
          "musicPlayerId": null,
          "links": {}
        },
        {
          "id": "wings-of-fire",
          "title": "Wings of Fire",
          "canonicalPath": "/music/tracks/wings-of-fire/wings-of-fire/",
          "duration": "",
          "lyricsFile": "",
          "hasLyricsFile": false,
          "hasVideo": false,
          "musicPlayerId": null,
          "links": {}
        },
        {
          "id": "we-are-the-triad",
          "title": "We are the Triad",
          "canonicalPath": "/music/tracks/wings-of-fire/we-are-the-triad/",
          "duration": "",
          "lyricsFile": "",
          "hasLyricsFile": false,
          "hasVideo": false,
          "musicPlayerId": null,
          "links": {}
        },
        {
          "id": "starlight-wounds",
          "title": "Starlight Wounds",
          "canonicalPath": "/music/tracks/wings-of-fire/starlight-wounds/",
          "duration": "",
          "lyricsFile": "",
          "hasLyricsFile": false,
          "hasVideo": false,
          "musicPlayerId": null,
          "links": {}
        },
        {
          "id": "ascension-hearts",
          "title": "Ascension Hearts",
          "canonicalPath": "/music/tracks/wings-of-fire/ascension-hearts/",
          "duration": "",
          "lyricsFile": "",
          "hasLyricsFile": false,
          "hasVideo": false,
          "musicPlayerId": null,
          "links": {}
        },
        {
          "id": "halo-in-the-storm",
          "title": "Halo in the Storm",
          "canonicalPath": "/music/tracks/wings-of-fire/halo-in-the-storm/",
          "duration": "",
          "lyricsFile": "",
          "hasLyricsFile": false,
          "hasVideo": false,
          "musicPlayerId": null,
          "links": {}
        }
      ]
    },
    {
      "id": "ascend",
      "title": "Ascend",
      "artist": "Triad of Angels",
      "genre": "Female Group, Cinematic Pop, Orchestral, Alternative, Soundtrack",
      "year": "May, 2025",
      "cover": "assets/images/albums/ascend-album.webp",
      "artistInfo": "Ascend leans further into lift, motion, and atmosphere, carrying Triad of Angels through a more expansive cinematic-pop frame.",
      "canonicalPath": "/music/albums/ascend/",
      "approxTimestamp": 1735689600000,
      "links": {
        "spotify": "https://open.spotify.com/album/5EetoHOZzPFoLGfM7XzTim?si=cWzTT5jKQ5KI-KkQYubADQ",
        "appleMusic": "https://music.apple.com/us/album/ascend/1812603057",
        "youTubeMusic": "https://music.youtube.com/playlist?list=OLAK5uy_n6axY2s6JOnfyXOqSsWQ9o1Rmz05azC4w&si=5HJAAMnu0iXVlpNb"
      },
      "trackCount": 10,
      "tracks": [
        {
          "id": "ascend",
          "title": "Ascend",
          "canonicalPath": "/music/tracks/ascend/ascend/",
          "duration": "",
          "lyricsFile": "",
          "hasLyricsFile": false,
          "hasVideo": false,
          "musicPlayerId": null,
          "links": {}
        },
        {
          "id": "fireproof",
          "title": "Fireproof",
          "canonicalPath": "/music/tracks/ascend/fireproof/",
          "duration": "",
          "lyricsFile": "",
          "hasLyricsFile": false,
          "hasVideo": false,
          "musicPlayerId": null,
          "links": {}
        },
        {
          "id": "we-are-light",
          "title": "We Are Light",
          "canonicalPath": "/music/tracks/ascend/we-are-light/",
          "duration": "",
          "lyricsFile": "",
          "hasLyricsFile": false,
          "hasVideo": false,
          "musicPlayerId": null,
          "links": {}
        },
        {
          "id": "echoes-of-hope",
          "title": "Echoes of Hope",
          "canonicalPath": "/music/tracks/ascend/echoes-of-hope/",
          "duration": "",
          "lyricsFile": "",
          "hasLyricsFile": false,
          "hasVideo": false,
          "musicPlayerId": null,
          "links": {}
        },
        {
          "id": "rising-tide",
          "title": "Rising Tide",
          "canonicalPath": "/music/tracks/ascend/rising-tide/",
          "duration": "",
          "lyricsFile": "",
          "hasLyricsFile": false,
          "hasVideo": false,
          "musicPlayerId": null,
          "links": {}
        },
        {
          "id": "hold-the-sky",
          "title": "Hold the Sky",
          "canonicalPath": "/music/tracks/ascend/hold-the-sky/",
          "duration": "",
          "lyricsFile": "",
          "hasLyricsFile": false,
          "hasVideo": false,
          "musicPlayerId": null,
          "links": {}
        },
        {
          "id": "home-to-my-heart",
          "title": "Home to My Heart",
          "canonicalPath": "/music/tracks/ascend/home-to-my-heart/",
          "duration": "",
          "lyricsFile": "",
          "hasLyricsFile": false,
          "hasVideo": false,
          "musicPlayerId": null,
          "links": {}
        },
        {
          "id": "unseen-wings",
          "title": "Unseen Wings",
          "canonicalPath": "/music/tracks/ascend/unseen-wings/",
          "duration": "",
          "lyricsFile": "",
          "hasLyricsFile": false,
          "hasVideo": false,
          "musicPlayerId": null,
          "links": {}
        },
        {
          "id": "breathe",
          "title": "Breathe",
          "canonicalPath": "/music/tracks/ascend/breathe/",
          "duration": "",
          "lyricsFile": "",
          "hasLyricsFile": false,
          "hasVideo": false,
          "musicPlayerId": null,
          "links": {}
        },
        {
          "id": "into-the-light",
          "title": "Into the Light",
          "canonicalPath": "/music/tracks/ascend/into-the-light/",
          "duration": "",
          "lyricsFile": "",
          "hasLyricsFile": false,
          "hasVideo": false,
          "musicPlayerId": null,
          "links": {}
        }
      ]
    },
    {
      "id": "celestia-the-light-within",
      "title": "Celestia: The Light Within",
      "artist": "Triad of Angels",
      "genre": "Cinematic, Pop, Ballads, Dance, Alternative",
      "year": "28th of May, 2025",
      "cover": "assets/images/albums/celestia-the-light-within-album.webp",
      "artistInfo": "Celestia: The Light Within keeps the trio in a brighter, more reflective lane, balancing lift, devotion, and melodic drama.",
      "canonicalPath": "/music/albums/celestia-the-light-within/",
      "approxTimestamp": 1735689600000,
      "links": {
        "spotify": "https://open.spotify.com/album/567eYko6C0VuGXKq4myvIC?si=pvGKdX-UQAa9q-XOwvpqkQ",
        "appleMusic": "https://music.apple.com/us/artist/triad-of-angels/1811109753",
        "youTubeMusic": "https://music.youtube.com/playlist?list=OLAK5uy_kj2xaQyIOlhLxcXxpBy4nzhUXhrWaUlic&si=UGXcIqtMu7Xwypm0"
      },
      "trackCount": 14,
      "tracks": [
        {
          "id": "aurora-rising",
          "title": "Aurora Rising",
          "canonicalPath": "/music/tracks/celestia-the-light-within/aurora-rising/",
          "duration": "",
          "lyricsFile": "",
          "hasLyricsFile": false,
          "hasVideo": false,
          "musicPlayerId": null,
          "links": {}
        },
        {
          "id": "wings-of-grace",
          "title": "Wings of Grace",
          "canonicalPath": "/music/tracks/celestia-the-light-within/wings-of-grace/",
          "duration": "",
          "lyricsFile": "",
          "hasLyricsFile": false,
          "hasVideo": false,
          "musicPlayerId": null,
          "links": {}
        },
        {
          "id": "echoes-of-eternity",
          "title": "Echoes of Eternity",
          "canonicalPath": "/music/tracks/celestia-the-light-within/echoes-of-eternity/",
          "duration": "",
          "lyricsFile": "",
          "hasLyricsFile": false,
          "hasVideo": false,
          "musicPlayerId": null,
          "links": {}
        },
        {
          "id": "elysian-groove",
          "title": "Elysian Groove",
          "canonicalPath": "/music/tracks/celestia-the-light-within/elysian-groove/",
          "duration": "",
          "lyricsFile": "",
          "hasLyricsFile": false,
          "hasVideo": false,
          "musicPlayerId": null,
          "links": {}
        },
        {
          "id": "sacred-ground",
          "title": "Sacred Ground",
          "canonicalPath": "/music/tracks/celestia-the-light-within/sacred-ground/",
          "duration": "",
          "lyricsFile": "",
          "hasLyricsFile": false,
          "hasVideo": false,
          "musicPlayerId": null,
          "links": {}
        },
        {